{
  "$schema": "http://json-schema.org/draft-07/schema#",
  "$id": "https://example.com/events/envelope.schema.json",
  "type": "object",
  "required": ["id", "type", "timestamp", "data"],
  "properties": {
    "id": { "type": "string", "minLength": 1 },
    "type": { "type": "string", "minLength": 1 },
    "timestamp": { "type": "string", "format": "date-time" },
    "actor": {
      "type": "object",
      "properties": { "userId": { "type": "string", "pattern": "^[0-9a-f]{8}-[0-9a-f]{4}-[0-9a-f]{4}-[0-9a-f]{4}-[0-9a-f]{12}$" } },
      "additionalProperties": true
    },
    "meta": {
      "type": "object",
      "properties": {
        "tenantId": { "type": "string", "pattern": "^[0-9a-f]{8}-[0-9a-f]{4}-[0-9a-f]{4}-[0-9a-f]{4}-[0-9a-f]{12}$" },
        "source": { "type": "string", "enum": ["frontend", "service", "worker"] },
        "traceId": { "type": "string" }
      },
      "additionalProperties": true
    },
    "data": { "type": "object" }
  },
  "additionalProperties": true
}
