{
  "id": "evt_01HF0000000000000000000000",
  "type": "identity.profile.updated",
  "timestamp": "2025-10-26T00:00:00Z",
  "actor": { "userId": "00000000-0000-0000-0000-000000000000" },
  "meta": { "tenantId": "11111111-1111-1111-1111-111111111111", "source": "frontend", "traceId": "trace-123" },
  "data": { "fields": ["name", "accessibilityAttributes"] }
}
