{
  "id": "evt_vrs_01",
  "type": "vrs.session.started",
  "timestamp": "2025-10-26T00:00:00Z",
  "actor": { "userId": "00000000-0000-0000-0000-000000000000" },
  "meta": { "tenantId": "11111111-1111-1111-1111-111111111111", "source": "service" },
  "data": { "sessionId": "bbbbbbbb-bbbb-bbbb-bbbb-bbbbbbbbbbbb", "userId": "00000000-0000-0000-0000-000000000000", "tenantId": "11111111-1111-1111-1111-111111111111", "provider": "ProviderX" }
}
