{
  "id": "evt_01HG0000000000000000000000",
  "type": "transcript.completed",
  "timestamp": "2025-10-26T00:00:00Z",
  "meta": { "tenantId": "11111111-1111-1111-1111-111111111111", "source": "worker", "traceId": "trace-456" },
  "data": { "videoId": "22222222-2222-2222-2222-222222222222", "tenantId": "11111111-1111-1111-1111-111111111111", "transcriptId": "33333333-3333-3333-3333-333333333333", "summary": "Transcription complete" }
}
